{
  "$schema": "https://json-schema.org/draft/2020-12/schema",
  "title": "Extracted source regions",
  "type": "object",
  "additionalProperties": false,
  "required": ["schema_version", "source_commit", "repository_url", "regions"],
  "properties": {
    "schema_version": { "const": 1 },
    "source_commit": { "type": "string", "minLength": 1 },
    "repository_url": { "type": "string", "format": "uri" },
    "regions": {
      "type": "array",
      "items": {
        "type": "object",
        "additionalProperties": false,
        "required": [
          "file",
          "region",
          "language",
          "code",
          "start_line",
          "end_line",
          "url"
        ],
        "properties": {
          "file": { "type": "string", "minLength": 1 },
          "region": { "type": "string", "minLength": 1 },
          "language": { "type": "string", "minLength": 1 },
          "code": { "type": "string" },
          "start_line": { "type": "integer", "minimum": 1 },
          "end_line": { "type": "integer", "minimum": 1 },
          "url": { "type": "string", "format": "uri" }
        }
      }
    }
  }
}
