{
  "schema_version": 1,
  "source_commit": "c027896b77cb9e1a1dc858e3a3bbc0d18ea7ad81",
  "repository_url": "https://github.com/chrisvoncsefalvay/photon-transport-book",
  "regions": [
    {
      "file": "python/dpt/autodiff.py",
      "region": "autodiff-first-order-lifetime",
      "language": "python",
      "code": "@dataclass(slots=True)\nclass FirstOrderPass:\n    \"\"\"Own one forward/reverse evaluation and its explicit diagnostic checkpoint.\n\n    Use as a context manager; pass .tape into canonical forward operators.\n    Call backward after exiting the context. Keep original inputs immutable\n    until close(). A new iteration requires a fresh context entry after close.\n    \"\"\"\n\n    workspaces: Sequence[CheckedWorkspace]\n    tape: Any = field(default=None, init=False, repr=False)\n    _state: str = field(default=\"new\", init=False)\n\n    def __enter__(self) -> FirstOrderPass:\n        if self._state != \"new\":\n            raise ContractError(\"a FirstOrderPass owns exactly one evaluation\")\n        require_no_tape()\n        for workspace in self.workspaces:\n            workspace.clear_status()\n        self.tape = load_warp().Tape()\n        self.tape.__enter__()\n        self._state = \"recording\"\n        return self\n\n    def __exit__(self, exc_type: Any, exc_value: Any, traceback: Any) -> None:\n        self.tape.__exit__(exc_type, exc_value, traceback)\n        self._state = \"recorded\"\n        if exc_type is not None:\n            self.close()\n\n    def backward(self, output: Any, seed: Any) -> None:\n        \"\"\"Seed a caller-owned output cotangent and complete numerical checks.\"\"\"\n        if self._state != \"recorded\":\n            raise ContractError(\"backward requires one completed, unconsumed forward pass\")\n        try:\n            wp = load_warp()\n            if not isinstance(output, wp.array) or output.grad is None:\n                raise ContractError(\"output must be a Warp CUDA array with a preallocated gradient\")\n            ctx = prepare_context(device=output.device)\n            ctx.array(output, \"output\", dtype=output.dtype, ndim=output.ndim)\n            ctx.array(seed, \"seed\", dtype=output.dtype, shape=tuple(output.shape), ndim=output.ndim)\n            self.tape.backward(grads={output: seed})\n            for workspace in self.workspaces:\n                workspace.check_status()\n            self._state = \"complete\"\n        except BaseException:\n            self.close()\n            raise\n\n    def close(self) -> None:\n        \"\"\"Clear accumulated cotangents and release every abandoned recording.\"\"\"\n        if self._state == \"recording\":\n            raise ContractError(\"exit the recording context before closing it\")\n        if self.tape is not None and self._state != \"closed\":\n            self.tape.zero()\n            self.tape.reset()\n            for workspace in self.workspaces:\n                discard = getattr(workspace, \"discard_recording\", None)\n                if discard is not None:\n                    discard(self.tape)\n        self._state = \"closed\"\n\n",
      "start_line": 24,
      "end_line": 86,
      "url": "/generated/source-files/python/dpt/autodiff.py.html#L24"
    },
    {
      "file": "python/dpt/bootstrap.py",
      "region": "bootstrap-package-identity",
      "language": "python",
      "code": "def package_identity() -> str:\n    \"\"\"Return the stable package name used by bootstrap wiring checks.\"\"\"\n    return \"differentiable-photon-transport\"\n\n",
      "start_line": 5,
      "end_line": 9,
      "url": "/generated/source-files/python/dpt/bootstrap.py.html#L5"
    },
    {
      "file": "python/dpt/detector.py",
      "region": "calibration-identifiability",
      "language": "python",
      "code": "@dataclass(frozen=True, slots=True)\nclass CalibrationSpec:\n    \"\"\"y = gain * exposure * mean + offset, in the declared output unit.\n\n    Gain is strictly positive; exposure is non-negative; offset is any finite\n    electronic baseline. A fixed flat-field may vary by pixel. Optimised gain\n    and offset are shared scalars: unconstrained correction images are excluded.\n    Exposure and gain cannot both be active because their scale is unidentifiable.\n    \"\"\"\n\n    output_unit: str\n    shared_gain: bool = True\n    shared_offset: bool = True\n    active_mean: bool = True\n    active_gain: bool = False\n    active_exposure: bool = False\n    active_offset: bool = False\n\n    def __post_init__(self) -> None:\n        if not self.output_unit.strip():\n            raise ContractError(\"calibration output unit is required\")\n        for name in (\n            \"shared_gain\",\n            \"shared_offset\",\n            \"active_mean\",\n            \"active_gain\",\n            \"active_exposure\",\n            \"active_offset\",\n        ):\n            if type(getattr(self, name)) is not bool:\n                raise ContractError(f\"{name} must be a boolean\")\n        if self.active_gain and self.active_exposure:\n            raise ContractError(\"fix gain or exposure before fitting the other scale\")\n        if self.active_gain and not self.shared_gain:\n            raise ContractError(\"a fitted gain must be a shared acquisition parameter\")\n        if self.active_offset and not self.shared_offset:\n            raise ContractError(\"a fitted offset must be a shared acquisition parameter\")\n\n",
      "start_line": 107,
      "end_line": 145,
      "url": "/generated/source-files/python/dpt/detector.py.html#L107"
    },
    {
      "file": "python/dpt/examples/acquisition_design.py",
      "region": "example-acquisition-information",
      "language": "python",